"DESCRIPTION","DURATION IN MS","NAME","PARENT SUITE","START TIME","STATUS","STOP TIME","SUB SUITE","SUITE","TEST CLASS","TEST METHOD"
"","7885","Create a structure page on PoE 2 project","ngf-tests","Fri Nov 28 06:47:57 UTC 2025","passed","Fri Nov 28 06:48:05 UTC 2025","Creating ST Pages","ngf.test.js","",""
"","5675","Create a guide page on Deadlock project","ngf-tests","Fri Nov 28 06:51:47 UTC 2025","passed","Fri Nov 28 06:51:53 UTC 2025","Creating UG Pages","ngf.test.js","",""
"","4695","Create a guide page on Valorant project","ngf-tests","Fri Nov 28 06:51:21 UTC 2025","passed","Fri Nov 28 06:51:26 UTC 2025","Creating UG Pages","ngf.test.js","",""
"","1863","Check the availability of advertising blocks for Path of Exile game","advertisement-tests","Fri Nov 28 06:46:31 UTC 2025","passed","Fri Nov 28 06:46:33 UTC 2025","","advertisement.test.js","",""
"","3251","Check the availability of advertising blocks for Hades 2 game","advertisement-tests","Fri Nov 28 06:46:19 UTC 2025","passed","Fri Nov 28 06:46:22 UTC 2025","","advertisement.test.js","",""
"","283","Checking sitemap for Deadlock game on https://stg.mobalytics.gg/sitemap.xml","sitemap-tests","Fri Nov 28 06:46:54 UTC 2025","passed","Fri Nov 28 06:46:54 UTC 2025","","sitemap.test.js","",""
"","1281","Error validation: 404 status code & title on usual page","others-tests","Fri Nov 28 06:57:34 UTC 2025","passed","Fri Nov 28 06:57:35 UTC 2025","","others.test.js","",""
"","278","Checking sitemap for PoE 2 game on https://stg.mobalytics.gg/sitemap.xml","sitemap-tests","Fri Nov 28 06:46:54 UTC 2025","passed","Fri Nov 28 06:46:55 UTC 2025","","sitemap.test.js","",""
"","4399","Create a tier list page on Riftbound project","ngf-tests","Fri Nov 28 06:52:47 UTC 2025","passed","Fri Nov 28 06:52:52 UTC 2025","Creating UG Pages","ngf.test.js","",""
"","5685","Game Manager can upload a video to CDN on the structure pages","ngf-tests","Fri Nov 28 06:55:21 UTC 2025","passed","Fri Nov 28 06:55:27 UTC 2025","Game Manager permission","ngf.test.js","",""
