"DESCRIPTION","DURATION IN MS","NAME","PARENT SUITE","START TIME","STATUS","STOP TIME","SUB SUITE","SUITE","TEST CLASS","TEST METHOD"
"","9497","Create a structure page on PoE project","ngf-tests","Sat Dec 06 06:46:55 UTC 2025","passed","Sat Dec 06 06:47:05 UTC 2025","Creating ST Pages","ngf.test.js","",""
"","3020","Check the availability of advertising blocks for 2XKO game","advertisement-tests","Sat Dec 06 06:44:37 UTC 2025","passed","Sat Dec 06 06:44:40 UTC 2025","","advertisement.test.js","",""
"","3717","Check the availability of advertising blocks for The Bazaar game","advertisement-tests","Sat Dec 06 06:44:32 UTC 2025","passed","Sat Dec 06 06:44:35 UTC 2025","","advertisement.test.js","",""
"","5618","Check static data on NGF Borderlands 4","ngf-tests","Sat Dec 06 06:55:30 UTC 2025","passed","Sat Dec 06 06:55:36 UTC 2025","","ngf.test.js","",""
"","8609","Create a structure page on Borderlands 4 project","ngf-tests","Sat Dec 06 06:48:02 UTC 2025","passed","Sat Dec 06 06:48:11 UTC 2025","Creating ST Pages","ngf.test.js","",""
"","285","Checking sitemap for Riftbound game on https://stg.mobalytics.gg/sitemap.xml","sitemap-tests","Sat Dec 06 06:45:40 UTC 2025","passed","Sat Dec 06 06:45:41 UTC 2025","","sitemap.test.js","",""
"","4900","Create a tier list page on PoE 2 project","ngf-tests","Sat Dec 06 06:51:57 UTC 2025","passed","Sat Dec 06 06:52:02 UTC 2025","Creating UG Pages","ngf.test.js","",""
"","337","Checking sitemap for ZZZ game on https://stg.mobalytics.gg/sitemap.xml","sitemap-tests","Sat Dec 06 06:44:43 UTC 2025","passed","Sat Dec 06 06:44:43 UTC 2025","","sitemap.test.js","",""
"","278","Checking sitemap for Champions game on https://stg.mobalytics.gg/sitemap.xml","sitemap-tests","Sat Dec 06 06:44:44 UTC 2025","passed","Sat Dec 06 06:44:45 UTC 2025","","sitemap.test.js","",""
"","2683","Check the availability of advertising blocks for Path of Exile game","advertisement-tests","Sat Dec 06 06:44:29 UTC 2025","passed","Sat Dec 06 06:44:32 UTC 2025","","advertisement.test.js","",""
"","5881","Create a guide page on Deadlock project","ngf-tests","Sat Dec 06 06:50:37 UTC 2025","passed","Sat Dec 06 06:50:43 UTC 2025","Creating UG Pages","ngf.test.js","",""
