"DESCRIPTION","DURATION IN MS","NAME","PARENT SUITE","START TIME","STATUS","STOP TIME","SUB SUITE","SUITE","TEST CLASS","TEST METHOD"
"","49428","Check x-moba-ssr-cache header & new content are present on MHW build page","others-tests","Fri Nov 28 15:52:04 UTC 2025","passed","Fri Nov 28 15:52:53 UTC 2025","","others.test.js","",""
"","6284","Create a structure page on Riftbound project","ngf-tests","Fri Nov 28 15:42:34 UTC 2025","passed","Fri Nov 28 15:42:40 UTC 2025","Creating ST Pages","ngf.test.js","",""
"","3070","Check the availability of advertising blocks for Deadlock game","advertisement-tests","Fri Nov 28 15:42:01 UTC 2025","passed","Fri Nov 28 15:42:04 UTC 2025","","advertisement.test.js","",""
"","1968","Check the availability of advertising blocks for Riftbound game","advertisement-tests","Fri Nov 28 15:42:15 UTC 2025","passed","Fri Nov 28 15:42:17 UTC 2025","","advertisement.test.js","",""
"","312","Checking sitemap for ZZZ game on https://stg.mobalytics.gg/sitemap.xml","sitemap-tests","Fri Nov 28 15:42:17 UTC 2025","passed","Fri Nov 28 15:42:18 UTC 2025","","sitemap.test.js","",""
"","5060","Check static data on NGF Monster Hunter Wilds","ngf-tests","Fri Nov 28 15:51:26 UTC 2025","passed","Fri Nov 28 15:51:31 UTC 2025","","ngf.test.js","",""
"","4667","Create a guide page on ZZZ project","ngf-tests","Fri Nov 28 15:47:31 UTC 2025","passed","Fri Nov 28 15:47:36 UTC 2025","Creating UG Pages","ngf.test.js","",""
"","3174","Check static data on NGF 2XKO","ngf-tests","Fri Nov 28 15:51:06 UTC 2025","passed","Fri Nov 28 15:51:09 UTC 2025","","ngf.test.js","",""
"","2131","Admin role has access to the Admin ST page","ngf-tests","Fri Nov 28 15:49:08 UTC 2025","passed","Fri Nov 28 15:49:10 UTC 2025","Admin permission","ngf.test.js","",""
"","12009","Admin role can duplicate the structure page","ngf-tests","Fri Nov 28 15:49:18 UTC 2025","passed","Fri Nov 28 15:49:30 UTC 2025","Admin permission","ngf.test.js","",""
"","4671","Create a tier list page on Borderlands 4 project","ngf-tests","Fri Nov 28 15:48:58 UTC 2025","passed","Fri Nov 28 15:49:02 UTC 2025","Creating UG Pages","ngf.test.js","",""
