"DESCRIPTION","DURATION IN MS","NAME","PARENT SUITE","START TIME","STATUS","STOP TIME","SUB SUITE","SUITE","TEST CLASS","TEST METHOD"
"","303","Checking sitemap for ZZZ game on https://stg.mobalytics.gg/sitemap.xml","sitemap-tests","Mon Dec 01 06:48:56 UTC 2025","passed","Mon Dec 01 06:48:56 UTC 2025","","sitemap.test.js","",""
"","246","Checking sitemap for Destiny 2 game on https://stg.mobalytics.gg/sitemap.xml","sitemap-tests","Mon Dec 01 06:48:58 UTC 2025","passed","Mon Dec 01 06:48:58 UTC 2025","","sitemap.test.js","",""
"","6386","Check the availability of advertising blocks for Elden Ring game","advertisement-tests","Mon Dec 01 06:48:07 UTC 2025","passed","Mon Dec 01 06:48:14 UTC 2025","","advertisement.test.js","",""
"","49283","Check x-moba-ssr-cache header & new content are present on MHW build page","others-tests","Mon Dec 01 07:00:50 UTC 2025","passed","Mon Dec 01 07:01:40 UTC 2025","","others.test.js","",""
"","1238","Check API Game Manager permission","ngf-tests","Mon Dec 01 06:59:53 UTC 2025","passed","Mon Dec 01 06:59:54 UTC 2025","Game Manager permission","ngf.test.js","",""
"","5625","Create a guide page on PoE 2 project","ngf-tests","Mon Dec 01 06:55:51 UTC 2025","passed","Mon Dec 01 06:55:56 UTC 2025","Creating UG Pages","ngf.test.js","",""
"","2240","St Widget contains ""Edit"" button, ""Delete"" button & ""Create Page"" button is present on ST Admin page for Admin role","ngf-tests","Mon Dec 01 06:58:03 UTC 2025","passed","Mon Dec 01 06:58:05 UTC 2025","Admin permission","ngf.test.js","",""
"","11593","Create a structure page on Bazaar project","ngf-tests","Mon Dec 01 06:50:53 UTC 2025","passed","Mon Dec 01 06:51:04 UTC 2025","Creating ST Pages","ngf.test.js","",""
"","4797","Create a tier list page on LoL project","ngf-tests","Mon Dec 01 06:57:06 UTC 2025","passed","Mon Dec 01 06:57:11 UTC 2025","Creating UG Pages","ngf.test.js","",""
"","245","Checking sitemap for PoE 2 game on https://stg.mobalytics.gg/sitemap.xml","sitemap-tests","Mon Dec 01 06:49:01 UTC 2025","passed","Mon Dec 01 06:49:01 UTC 2025","","sitemap.test.js","",""
"","3382","Admin role has access to SEO modal on the structure pages","ngf-tests","Mon Dec 01 06:58:47 UTC 2025","passed","Mon Dec 01 06:58:50 UTC 2025","Admin permission","ngf.test.js","",""
